Timestamp,scholarship_id,user_id,award_name,description,requirement,reward_amount,deadline
10/19/2021 15:44,1,4,UIC Cool Student Scholarship,A scholarship for cool students attending UIC,"Must be attending UIC, must be cool, must have some form of financial need, must have at least a 3.0 GPA",10000,10/19/2021
11/5/2021 15:39,2,4,FUA Scholarship,"The Fearless Undocumented Alliance at UIC is offering up to $5,000 of rewards for undocumented students at UIC. ","Must be an undocumented undergraduate or graduate student at UIC, Must have at least a 3.0 GPA, Must have at least 1 letter of recommendation.",1000,3/21/2022
11/5/2021 15:43,3,3,The Aga Khan Foundation International Scholarship,The Aga Khan Foundation International Scholarship provides scholarships to students from select developing countries who have no other source of financial help for their graduate studies. The scholarships are 50 percent grant and 50 percent loan.,"The main criteria for selecting award winners are: l) consistently excellent academic records, 2) genuine financial need, 3) admission to a highly reputable university or programme of study",50000,3/31/2022
11/5/2021 15:47,4,5,Yale University Scholarship,"Yale University Scholarship is a fully funded scholarship for international students. This scholarship is offered for undergraduate, masters and PhD.","Must be a  undergraduate, masters or PhD student at Yale University.",50000,5/13/2022
11/5/2021 15:50,5,2,PepsiCo Cesar Chavez Latino Scholarship,This scholarship applies to Hispanic students who are beginning or continuing their studies at higher educational institutions in Arizona and California's Central Valley ,"Eligible applicants must: demonstrate leadership in extra-curricular activities, a commitment to volunteer service in the community and financial need; be an incoming or continuing full-time undergraduate student full-time; have a 3.0 GPA; be a U.S. Citizen, Permanent Legal Resident, Undocumented, DACA, CA Dreamer or Eligible Non-Citizen (as defined by FAFSA); and, must be a resident and attending a college in Arizona or California's Central Valley (see website for more details).",5000,7/20/2022
